Title,URL,Reviewer1,Decision1,Comments1,Reviewer2,Decision2,Comments2
chemotherapeutic options for primary brain tumors,https://pubmed.ncbi.nlm.nih.gov/17032559/,Soheil,,,Cem,,
validation of lesion simulations in clinical ct data for anonymized chest and abdominal ct databases,https://pubmed.ncbi.nlm.nih.gov/30703259/,Soheil,,,Lucas,,
satisfaction with care among low-income women with breast cancer,https://pubmed.ncbi.nlm.nih.gov/20088662/,Soheil,,,Lucas,,
a review of and algorithmic approach to soft palate reconstruction,https://pubmed.ncbi.nlm.nih.gov/30920582/,Soheil,,,Lucas,,
genes involved in radiation therapy response in head and neck cancers,https://pubmed.ncbi.nlm.nih.gov/19117295/,Soheil,,,Lucas,,
treatment of cervical paragangliomas,https://pubmed.ncbi.nlm.nih.gov/23021979/,Soheil,,,Lucas,,
stereotactic radiation techniques in the treatment of acoustic schwannomas,https://pubmed.ncbi.nlm.nih.gov/17544696/,Soheil,,,Cem,,
genetic evolutionary taboo search for optimal marker placement in infrared patient setup,https://pubmed.ncbi.nlm.nih.gov/17881802/,Soheil,,,Cem,,
"malignant tumours of the eye: epidemiology, diagnostic methods and radiotherapy",https://pubmed.ncbi.nlm.nih.gov/26508321/,Soheil,,,Cem,,
molecular imaging in the framework of personalized cancer medicine,https://pubmed.ncbi.nlm.nih.gov/24511645/,Soheil,,,Cem,,
work disability and its determinants in patients with pituitary tumor-related disease,https://pubmed.ncbi.nlm.nih.gov/30288666/,Soheil,,,Lucas,,
tree-type algorithm for statistical analysis in chronic toxicity studies,https://pubmed.ncbi.nlm.nih.gov/9779409/,Soheil,,,Cem,,
location of radiotherapy centers: an exploratory geographic analysis for belgium,https://pubmed.ncbi.nlm.nih.gov/23089067/,Soheil,,,Cem,,
