Title,URL,Publication Day,Publication Month,Publication Year,Journal Name,Journal Volume,Journal Issue,Journal ISSN,Author 1 First Name,Author 1 Last Name,Author 2 First Name,Author 2 Last Name,Author 1 Affiliation,Author 3 First Name,Author 3 Last Name,Author 4 First Name,Author 4 Last Name,Author 5 First Name,Author 5 Last Name,Author 6 First Name,Author 6 Last Name,Author 7 First Name,Author 7 Last Name,Author 8 First Name,Author 8 Last Name,Author 9 First Name,Author 9 Last Name,Author 10 First Name,Author 10 Last Name,Author 11 First Name,Author 11 Last Name,Author 12 First Name,Author 12 Last Name,Author 13 First Name,Author 13 Last Name,Author 14 First Name,Author 14 Last Name,Author 15 First Name,Author 15 Last Name,Author 16 First Name,Author 16 Last Name,Author 17 First Name,Author 17 Last Name,Author 18 First Name,Author 18 Last Name,Author 19 First Name,Author 19 Last Name,Author 20 First Name,Author 20 Last Name,Author 21 First Name,Author 21 Last Name,Author 22 First Name,Author 22 Last Name,Author 23 First Name,Author 23 Last Name,Author 24 First Name,Author 24 Last Name,Author 25 First Name,Author 25 Last Name,Author 26 First Name,Author 26 Last Name,Author 27 First Name,Author 27 Last Name,Collective Author 1,Author 2 Affiliation,Author 3 Affiliation,Author 4 Affiliation,Author 5 Affiliation,Author 6 Affiliation,Author 7 Affiliation,Author 8 Affiliation,Author 9 Affiliation,Author 10 Affiliation,Author 11 Affiliation,Author 12 Affiliation,Author 13 Affiliation,Author 14 Affiliation,Author 15 Affiliation,Author 16 Affiliation,Author 17 Affiliation,Author 18 Affiliation,Author 19 Affiliation,Author 20 Affiliation,Author 21 Affiliation,Author 22 Affiliation,Author 23 Affiliation,Collective Author 2,Author 28 First Name,Author 28 Last Name,Author 29 First Name,Author 29 Last Name,Author 30 First Name,Author 30 Last Name,Author 31 First Name,Author 31 Last Name,Author 32 First Name,Author 32 Last Name,Author 33 First Name,Author 33 Last Name
treatment for patients with rectal cancer and a clinical complete response to neoadjuvant therapy: a decision analysis,https://pubmed.ncbi.nlm.nih.gov/19502849/,XX,05,2009,Diseases of the colon and rectum,52,5,1530-0358,Heather B,Neuman,Elena B,Elkin,"Department of Surgery, Memorial Sloan-Kettering Cancer Center, New York, New York 10065, USA.",Jose G,Guillem,Philip B,Paty,Martin R,Weiser,W Douglas,Wong,Larissa K,Temple,,,,,,,,,,,,,,,,,,,,,,,,,,,,,,,,,,,,,,,,,,,,,,,,,,,,,,,,,,,,,,,,,,,,,,,,,,,,
the current state of brachytherapy nomograms for patients with clinically localized prostate cancer,https://pubmed.ncbi.nlm.nih.gov/19544540/,01,07,2009,Cancer,115,13 Suppl,0008-543X,Carvell T,Nguyen,Michael J,Zelefsky,"Glickman Urological and Kidney Institute, Cleveland Clinic, Cleveland, Ohio, USA.",Michael W,Kattan,,,,,,,,,,,,,,,,,,,,,,,,,,,,,,,,,,,,,,,,,,,,,,,,,,,,,,,,,,,,,,,,,,,,,,,,,,,,,,,,,,,,
predictive models of toxicity with external radiotherapy for prostate cancer: clinical issues,https://pubmed.ncbi.nlm.nih.gov/19544543/,01,07,2009,Cancer,115,13 Suppl,0008-543X,Riccardo,Valdagni,Tiziana,Rancati,"Prostate Program, Scientific Directorate, National Cancer Institute, Milan, Italy. riccardo.valdagni@istitutotumori.mi.it",Claudio,Fiorino,,,,,,,,,,,,,,,,,,,,,,,,,,,,,,,,,,,,,,,,,,,,,,,,,,,,,,,,,,,,,,,,,,,,,,,,,,,,,,,,,,,,
positron-emission tomography (pet) and pet/ct in head and neck cancer - recommendations of an interdisciplinary consensus conference,https://pubmed.ncbi.nlm.nih.gov/19219754/,13,02,2009,Laryngo- rhino- otologie,88,2,0935-8943,S,Kohlfürst,M,Markitz,"Abteilung für Nuklearmedizin und Endokrinologie, PET/CT Zentrum, LKH Klagenfurt, Osterreich. susanne.kohlfuerst@lkh-klu.at",W,Raunik,H E,Eckel,E,Kresnik,K,Hausegger,M,Salzwimmer,A,Gaggl,F,Chiari,P,Lind,,,,,,,,,,,,,,,,,,,,,,,,,,,,,,,,,,,,,,,,,,,,,,,,,,,,,,,,,,,,,,,,,,,,,,
a decision aid for intensity-modulated radiation-therapy plan selection in prostate cancer based on a prognostic bayesian network and a markov model,https://pubmed.ncbi.nlm.nih.gov/19157811/,20,01,2009,Artificial intelligence in medicine,46,2,1873-2860,Wade P,Smith,Jason,Doctor,"Department of Radiation Oncology, Box 356043, University of Washington, 1959 NE Pacific St., Seattle, WA 98195-6043, USA. wpsmith@u.washington.edu",Jürgen,Meyer,Ira J,Kalet,Mark H,Phillips,,,,,,,,,,,,,,,,,,,,,,,,,,,,,,,,,,,,,,,,,,,,,,,,,,,,,,,,,,,,,,,,,,,,,,,,,,,,,,,,
cost-utility analysis of the cyberknife system for metastatic spinal tumors,https://pubmed.ncbi.nlm.nih.gov/19165078/,XX,02,2009,Neurosurgery,64,2 Suppl,1524-4040,Frank J,Papatheofanis,Erin,Williams,"Division of Health Policy, Department of Radiology and Economics, Rebecca and John Moores Cancer Center, University of California, San Diego, California 92103-8758, USA. fpapath@ucsd.edu",Steven D,Chang,,,,,,,,,,,,,,,,,,,,,,,,,,,,,,,,,,,,,,,,,,,,,,,,,,,,,,,,,,,,,,,,,,,,,,,,,,,,,,,,,,,,
cost effectiveness of risk-prediction tools in selecting patients for immediate post-prostatectomy treatment,https://pubmed.ncbi.nlm.nih.gov/19351214/,XX,XX,2009,Molecular diagnosis & therapy,13,1,1177-1062,Valentina Bayer,Zubek,Andre,Konski,"Aureon Laboratories, Inc., Yonkers, New York 10701, USA. valentina.bayer@aureon.com",,,,,,,,,,,,,,,,,,,,,,,,,,,,,,,,,,,,,,,,,,,,,,,,,,,,,,,,,,,,,,,,,,,,,,,,,,,,,,,,,,,,,,
decision involvement and receipt of mastectomy among racially and ethnically diverse breast cancer patients,https://pubmed.ncbi.nlm.nih.gov/19720966/,31,08,2009,Journal of the National Cancer Institute,101,19,1460-2105,Sarah T,Hawley,Jennifer J,Griggs,"Division of General Medicine, Department of Internal Medicine, University of Michigan, 300 N. Ingalls, Ste 7E12, Box 0429, Ann Arbor, MI 48109-0429, USA. sarahawl@med.umich.edu",Ann S,Hamilton,John J,Graff,Nancy K,Janz,Monica,Morrow,Reshma,Jagsi,Barbara,Salem,Steven J,Katz,,,,,,,,,,,,,,,,,,,,,,,,,,,,,,,,,,,,,,,,,,,,,,,,,,,,,,,,,,,,,,,,,,,,,,,,
cost-effectiveness of ct and pet-ct for determining the need for adjuvant neck dissection in locally advanced head and neck cancer,https://pubmed.ncbi.nlm.nih.gov/19833820/,15,10,2009,Annals of oncology : official journal of the European Society for Medical Oncology,21,5,1569-8041,D J,Sher,R B,Tishler,"Department of Radiation Oncology, Dana-Farber Cancer Institute and Brigham and Women's Hospital, Boston, MA 02115, USA. dsher@lroc.harvard.edu",D,Annino,R S,Punglia,,,,,,,,,,,,,,,,,,,,,,,,,,,,,,,,,,,,,,,,,,,,,,,,,,,,,,,,,,,,,,,,,,,,,,,,,,,,,,,,,,
