Title,URL,Publication Day,Publication Month,Publication Year,Journal Name,Journal Volume,Journal ISSN,Author 1 First Name,Author 1 Last Name,Author 1 Affiliation,Author 2 First Name,Author 2 Last Name,Author 2 Affiliation,Author 3 First Name,Author 3 Last Name,Author 3 Affiliation,Journal Issue,Author 4 First Name,Author 4 Last Name,Author 4 Affiliation,Author 5 First Name,Author 5 Last Name,Author 5 Affiliation,Author 6 First Name,Author 6 Last Name,Author 6 Affiliation,Author 7 First Name,Author 7 Last Name,Author 7 Affiliation,Author 8 First Name,Author 8 Last Name,Author 8 Affiliation,Author 9 First Name,Author 9 Last Name,Author 9 Affiliation,Author 10 First Name,Author 10 Last Name,Author 10 Affiliation,Author 11 First Name,Author 11 Last Name,Author 11 Affiliation,Author 12 First Name,Author 12 Last Name,Author 12 Affiliation,Author 13 First Name,Author 13 Last Name,Author 13 Affiliation,Author 14 First Name,Author 14 Last Name,Author 14 Affiliation,Author 15 First Name,Author 15 Last Name,Author 15 Affiliation,Author 16 First Name,Author 16 Last Name,Author 16 Affiliation,Author 17 First Name,Author 17 Last Name,Author 17 Affiliation,Author 18 First Name,Author 18 Last Name,Author 18 Affiliation,Author 19 First Name,Author 19 Last Name,Author 19 Affiliation,Author 20 First Name,Author 20 Last Name,Author 20 Affiliation,Author 21 First Name,Author 21 Last Name,Author 21 Affiliation,Author 22 First Name,Author 22 Last Name,Author 22 Affiliation,Collective Author 1
analysis of acute-phase toxicities of intensity-modulated proton therapy using a model-based approach in pharyngeal cancer patients,https://pubmed.ncbi.nlm.nih.gov/33372202/,10,03,2021,Journal of radiation research,62,1349-9157,Koichi,Yasuda,"Department of Radiation Oncology, Hokkaido University Hospital, North-15 West-7, Sapporo, Japan.",Hideki,Minatogawa,"Department of Radiation Oncology, Hokkaido University Hospital, North-15 West-7, Sapporo, Japan.",Yasuhiro,Dekura,"Department of Radiation Oncology, Hokkaido University Hospital, North-15 West-7, Sapporo, Japan.",2,Seishin,Takao,"Department of Medical Physics, Hokkaido University Hospital, North-15 West-7, Sapporo, Japan.",Masaya,Tamura,"Department of Medical Physics, Hokkaido University Hospital, North-15 West-7, Sapporo, Japan.",Nayuta,Tsushima,"Department of Otolaryngology-Head and Neck Surgery, Faculty and Graduate School of Medicine,Hokkaido University, North-15 West-7, Sapporo, Japan.",Takayoshi,Suzuki,"Department of Otolaryngology-Head and Neck Surgery, Faculty and Graduate School of Medicine,Hokkaido University, North-15 West-7, Sapporo, Japan.",Satoshi,Kano,"Department of Otolaryngology-Head and Neck Surgery, Faculty and Graduate School of Medicine,Hokkaido University, North-15 West-7, Sapporo, Japan.",Takatsugu,Mizumachi,"Department of Otolaryngology-Head and Neck Surgery, Faculty and Graduate School of Medicine,Hokkaido University, North-15 West-7, Sapporo, Japan.",Takashi,Mori,"Department of Oral Radiology, Graduate School of Dental Medicine, Hokkaido University, Hokkaido University, North-13 West-7, Sapporo, Japan.",Kentaro,Nishioka,"Department of Radiation Medical Science and Engineering, Faculty and Graduate School of Medicine,Hokkaido University, North-15 West-7, Sapporo, Japan.",Motoyasu,Shido,"Department of Radiation Oncology, Hokkaido University Hospital, North-15 West-7, Sapporo, Japan.",Norio,Katoh,"Department of Radiation Oncology, Faculty and Graduate School of Medicine, Hokkaido University, North-15 West-7, Sapporo, Japan.",Hiroshi,Taguchi,"Department of Radiation Oncology, Hokkaido University Hospital, North-15 West-7, Sapporo, Japan.",Noriyuki,Fujima,"Department of Radiology, Boston Medical Center, Boston University School of Medicine, Boston, MA, USA.",Rikiya,Onimaru,"Department of Radiation Oncology, Faculty and Graduate School of Medicine, Hokkaido University, North-15 West-7, Sapporo, Japan.",Isao,Yokota,"Department of Biostatistics, Faculty and Graduate School of Medicine, Hokkaido University, North-15 West-7, Sapporo, Japan.",Keiji,Kobashi,"Department of Medical Physics, Hokkaido University Hospital, North-15 West-7, Sapporo, Japan.",Shinichi,Shimizu,"Department of Radiation Medical Science and Engineering, Faculty and Graduate School of Medicine,Hokkaido University, North-15 West-7, Sapporo, Japan.",Akihiro,Homma,"Department of Otolaryngology-Head and Neck Surgery, Faculty and Graduate School of Medicine,Hokkaido University, North-15 West-7, Sapporo, Japan.",Hiroki,Shirato,"Department of Radiation Oncology, Faculty and Graduate School of Medicine, Hokkaido University, North-15 West-7, Sapporo, Japan.",Hidefumi,Aoyama,"Department of Radiation Oncology, Faculty and Graduate School of Medicine, Hokkaido University, North-15 West-7, Sapporo, Japan.",
determining clinical patient selection guidelines for head and neck adaptive radiation therapy using random forest modelling and a novel simplification heuristic,https://pubmed.ncbi.nlm.nih.gov/34164338/,07,06,2021,Frontiers in oncology,11,2234-943X,Sarah,Weppler,"Department of Physics and Astronomy, University of Calgary, Calgary, AB, Canada.",Harvey,Quon,"Department of Radiation Oncology, Tom Baker Cancer Centre, Calgary, AB, Canada.",Colleen,Schinkel,"Department of Medical Physics, Tom Baker Cancer Centre, Calgary, AB, Canada.",,James,Ddamba,"Department of Radiation Oncology, Tom Baker Cancer Centre, Calgary, AB, Canada.",Nabhya,Harjai,"Cumming School of Medicine, University of Calgary, Calgary, AB, Canada.",Clarisse,Vigal,"Department of Physics and Astronomy, University of Calgary, Calgary, AB, Canada.",Craig A,Beers,"Cumming School of Medicine, University of Calgary, Calgary, AB, Canada.",Lukas,Van Dyke,"Department of Medical Physics, Tom Baker Cancer Centre, Calgary, AB, Canada.",Wendy,Smith,"Department of Physics and Astronomy, University of Calgary, Calgary, AB, Canada.",,,,,,,,,,,,,,,,,,,,,,,,,,,,,,,,,,,,,,,,
validation of automated complex head and neck treatment planning with pencil beam scanning proton therapy,https://pubmed.ncbi.nlm.nih.gov/34936205/,22,12,2021,Journal of applied clinical medical physics,23,1526-9914,Samantha Grace,Hedrick,"Provision CARES Proton Therapy Center, Knoxville, Tennessee, USA.",Scott,Petro,"Provision CARES Proton Therapy Center, Knoxville, Tennessee, USA.",Alex,Ward,"Provision CARES Proton Therapy Center, Knoxville, Tennessee, USA.",2,Bart,Morris,"Provision CARES Proton Therapy Center, Knoxville, Tennessee, USA.",,,,,,,,,,,,,,,,,,,,,,,,,,,,,,,,,,,,,,,,,,,,,,,,,,,,,,,
intensity-modulated proton therapy (impt) versus intensity-modulated radiation therapy (imrt) for the treatment of head and neck cancer: a dosimetric comparison,https://pubmed.ncbi.nlm.nih.gov/33648823/,26,02,2021,Medical dosimetry : official journal of the American Association of Medical Dosimetrists,46,1873-4022,My-Lien,Nguyen,"Department of Radiation Oncology, University of Oklahoma Health Sciences Center, Oklahoma City, OK 73104, USA.",J Nathan,Cantrell,"Department of Radiation Oncology, University of Oklahoma Health Sciences Center, Oklahoma City, OK 73104, USA.",Salahuddin,Ahmad,"Department of Radiation Oncology, University of Oklahoma Health Sciences Center, Oklahoma City, OK 73104, USA.",3,Christina,Henson,"Department of Radiation Oncology, University of Oklahoma Health Sciences Center, Oklahoma City, OK 73104, USA.",,,,,,,,,,,,,,,,,,,,,,,,,,,,,,,,,,,,,,,,,,,,,,,,,,,,,,,
implementation and experimental validation of a robust hybrid direct aperture optimization approach for mixed-beam radiotherapy,https://pubmed.ncbi.nlm.nih.gov/34585756/,14,10,2021,Medical physics,48,2473-4209,Emily,Heath,"Carleton Laboratory for Radiotherapy Physics, Carleton University, Ottawa, Canada.",Silvan,Mueller,"Division of Medical Radiation Physics and Department of Radiation Oncology, Inselspital, Bern University Hospital and University of Bern, Bern, Switzerland.",Gian,Guyer,"Division of Medical Radiation Physics and Department of Radiation Oncology, Inselspital, Bern University Hospital and University of Bern, Bern, Switzerland.",11,Alisha,Duetschler,"Division of Medical Radiation Physics and Department of Radiation Oncology, Inselspital, Bern University Hospital and University of Bern, Bern, Switzerland.",Olgun,Elicin,"Division of Medical Radiation Physics and Department of Radiation Oncology, Inselspital, Bern University Hospital and University of Bern, Bern, Switzerland.",Daniel,Aebersold,"Division of Medical Radiation Physics and Department of Radiation Oncology, Inselspital, Bern University Hospital and University of Bern, Bern, Switzerland.",Michael K,Fix,"Division of Medical Radiation Physics and Department of Radiation Oncology, Inselspital, Bern University Hospital and University of Bern, Bern, Switzerland.",Peter,Manser,"Division of Medical Radiation Physics and Department of Radiation Oncology, Inselspital, Bern University Hospital and University of Bern, Bern, Switzerland.",,,,,,,,,,,,,,,,,,,,,,,,,,,,,,,,,,,,,,,,,,,
technical note: first report on an in vivo range probing quality control procedure for scanned proton beam therapy in head and neck cancer patients,https://pubmed.ncbi.nlm.nih.gov/33428795/,06,02,2021,Medical physics,48,2473-4209,Arturs,Meijers,"Department of Radiation Oncology, University of Groningen, University Medical Centre Groningen, Groningen, The Netherlands.",Carmen,Seller Oria,"Department of Radiation Oncology, University of Groningen, University Medical Centre Groningen, Groningen, The Netherlands.",Jeffrey,Free,"Department of Radiation Oncology, University of Groningen, University Medical Centre Groningen, Groningen, The Netherlands.",3,Johannes A,Langendijk,"Department of Radiation Oncology, University of Groningen, University Medical Centre Groningen, Groningen, The Netherlands.",Antje C,Knopf,"Department of Radiation Oncology, University of Groningen, University Medical Centre Groningen, Groningen, The Netherlands.",Stefan,Both,"Department of Radiation Oncology, University of Groningen, University Medical Centre Groningen, Groningen, The Netherlands.",,,,,,,,,,,,,,,,,,,,,,,,,,,,,,,,,,,,,,,,,,,,,,,,,
anatomic changes in head and neck intensity-modulated proton therapy: comparison between robust optimization and online adaptation,https://pubmed.ncbi.nlm.nih.gov/33741469/,17,03,2021,Radiotherapy and oncology : journal of the European Society for Therapeutic Radiology and Oncology,159,1879-0887,Arthur,Lalonde,"Department of Radiation Oncology, Massachusetts General Hospital & Harvard Medical School, Boston, USA. Electronic address: alalonde@mgh.harvard.edu.",Mislav,Bobić,"Department of Radiation Oncology, Massachusetts General Hospital & Harvard Medical School, Boston, USA; ETH Zürich, Zürich, Switzerland.",Brian,Winey,"Department of Radiation Oncology, Massachusetts General Hospital & Harvard Medical School, Boston, USA.",,Joost,Verburg,"Department of Radiation Oncology, Massachusetts General Hospital & Harvard Medical School, Boston, USA.",Gregory C,Sharp,"Department of Radiation Oncology, Massachusetts General Hospital & Harvard Medical School, Boston, USA.",Harald,Paganetti,"Department of Radiation Oncology, Massachusetts General Hospital & Harvard Medical School, Boston, USA.",,,,,,,,,,,,,,,,,,,,,,,,,,,,,,,,,,,,,,,,,,,,,,,,,
"dosimetric comparison of helical tomotherapy, volumetric-modulated arc therapy, and intensity-modulated proton therapy for angiosarcoma of the scalp",https://pubmed.ncbi.nlm.nih.gov/33517860/,XX,XX,2021,Technology in cancer research & treatment,20,1533-0338,Tomoki,Mizuno,"Department of Radiology, Nagoya City University Graduate School of Medical Sciences, Nagoya, Aichi, Japan.",Natsuo,Tomita,"Department of Radiology, Nagoya City University Graduate School of Medical Sciences, Nagoya, Aichi, Japan.",Taiki,Takaoka,"Narita Memorial Proton Center, Toyohashi, Aichi, Japan.",,Masashi,Tomida,"Narita Memorial Proton Center, Toyohashi, Aichi, Japan.",Hiroshi,Fukuma,"Department of Radiology, Nagoya City University Graduate School of Medical Sciences, Nagoya, Aichi, Japan.",Takahiro,Tsuchiya,"Department of Radiology, Nagoya City University Graduate School of Medical Sciences, Nagoya, Aichi, Japan.",Yuta,Shibamoto,"Department of Radiology, Nagoya City University Graduate School of Medical Sciences, Nagoya, Aichi, Japan.",,,,,,,,,,,,,,,,,,,,,,,,,,,,,,,,,,,,,,,,,,,,,,
