validation and simplification of the radiation therapy oncology group recursive partitioning analysis classification for glioblastoma,https://pubmed.ncbi.nlm.nih.gov/20888136/,01,10,2010,"International journal of radiation oncology, biology, physics",81,3,1879-355X,Jing,Li,Meihua,Wang,"University of Texas MD Anderson Cancer Center, Houston, TX, USA.",Minhee,Won,Edward G,Shaw,Christopher,Coughlin,Walter J,Curran,Minesh P,Mehta,,,,,,,,,,,,,,,,,,,,,,,,,,,,,,,,,,,,,,,,,,,,,,,,,,,,,,,,,,,,,,,,,,,,,,,,,,,,
active surveillance compared with initial treatment for men with low-risk prostate cancer: a decision analysis,https://pubmed.ncbi.nlm.nih.gov/21119084/,01,12,2010,JAMA,304,21,1538-3598,Julia H,Hayes,Daniel A,Ollendorf,"Lank Center for Genitourinary Oncology, Dana-Farber Cancer Institute, Boston, MA 02115, USA. julia_hayes@dfci.harvard.edu",Steven D,Pearson,Michael J,Barry,Philip W,Kantoff,Susan T,Stewart,Vibha,Bhatnagar,Christopher J,Sweeney,James E,Stahl,Pamela M,McMahon,,,,,,,,,,,,,,,,,,,,,,,,,,,,,,,,,,,,,,,,,,,,,,,,,,,,,,,,,,,,,,,,,,,,,,
refined nomogram incorporating standing cough test improves prediction of male transobturator sling success,https://pubmed.ncbi.nlm.nih.gov/29717511/,01,05,2018,Neurourology and urodynamics,37,8,1520-6777,Nabeel A,Shakir,Joceline S,Fuchs,"Department of Urology, UT Southwestern Medical Center, Dallas, Texas.",Maxim J,McKibben,Boyd R,Viers,Travis J,Pagliara,Jeremy M,Scott,Allen F,Morey,,,,,,,,,,,,,,,,,,,,,,,,,,,,,,,,,,,,,,,,,,"Department of Urology, UT Southwestern Medical Center, Dallas, Texas.","Department of Urology, UT Southwestern Medical Center, Dallas, Texas.","Department of Urology, UT Southwestern Medical Center, Dallas, Texas.","Department of Urology, UT Southwestern Medical Center, Dallas, Texas.","Department of Urology, UT Southwestern Medical Center, Dallas, Texas.","Department of Urology, UT Southwestern Medical Center, Dallas, Texas.",,,,,,,,,,,,,,,,,,,,,,,,,,,,,
"guidelines for clinical practice: standards, options and recommendations 2005 for the management of adult patients exhibiting an m0 cutaneous melanoma, full report. national federation of cancer campaign centers. french dermatology society. update of the 1995 consensus conference and the 1998 standards, options, and recommendations",https://pubmed.ncbi.nlm.nih.gov/16521904/,XX,12,2005,Annales de dermatologie et de venereologie,132,12 Pt 2,0151-9638,S,Négrier,P,Saiag,"Centre Léon-Bérard, Lyon.",B,Guillot,O,Verola,M F,Avril,C,Bailly,D,Cupissol,S,Dalac,A,Danino,B,Dreno,J J,Grob,M T,Leccia,C,Renaud-Vilmer,L,Bosquet,,,,,,,,,,,,,,,,,,,,,,,,,,,National Federation of Cancer Campaign Centers,,,,,,,,,,,,,,,,,,,,,,,French Dermatology Society,,,,,,,,,,,,
why older adults make more immediate treatment decisions about cancer than younger adults,https://pubmed.ncbi.nlm.nih.gov/17874951/,XX,09,2007,Psychology and aging,22,3,0882-7974,Bonnie J F,Meyer,Andrew P,Talbot,"Department of Educational and School Psychology and Special Education, University Park Campus, Pennsylvania State University, University Park, PA 16802, USA. bjm8@psu.edu",Carlee,Ranalli,,,,,,,,,,,,,,,,,,,,,,,,,,,,,,,,,,,,,,,,,,,,,,,,,,,,,,,,,,,,,,,,,,,,,,,,,,,,,,,,,,,,
"cost-effectiveness analysis of chemoradiation therapy versus transoral robotic surgery for human papillomavirus-associated, clinical n2 oropharyngeal cancer",https://pubmed.ncbi.nlm.nih.gov/26867880/,10,11,2015,"International journal of radiation oncology, biology, physics",94,3,1879-355X,David J,Sher,Mary Jo,Fidler,"Department of Radiation Oncology, University of Texas Southwestern Medical Center, Dallas, Texas. Electronic address: david.sher@utsouthwestern.edu.",Roy B,Tishler,Kerstin,Stenson,Samer,al-Khudari,,,,,,,,,,,,,,,,,,,,,,,,,,,,,,,,,,,,,,,,,,,,,,"Section of Medical Oncology, Rush University Medical Center, Chicago, Illinois.","Department of Radiation Oncology, Brigham and Women's Hospital and Dana-Farber Cancer Institute, Boston, Massachusetts.","Department of Otolaryngology, Rush University Medical Center, Chicago, Illinois.","Department of Otolaryngology, Rush University Medical Center, Chicago, Illinois.",,,,,,,,,,,,,,,,,,,,,,,,,,,,,,,
treatment of cervical cancer,https://pubmed.ncbi.nlm.nih.gov/25090765/,XX,06,2014,La Revue du praticien,64,6,0035-2640,Cyril,Touboul,Dounia,Skalli,,Eric,Guillo,Michel,Martin,Emmanuelle,Mallaurie,Dhouha,Mansouri,Issam,Abd Al Samad,Naima,Chabi,Sylvie,Hospitel,Martin,Koskas,Bassam,Haddad,,,,,,,,,,,,,,,,,,,,,,,,,,,,,,,,,,,,,,,,,,,,,,,,,,,,,,,,,,,,,,,,,,,,
radiotherapy is a cost-effective palliative treatment for patients with bone metastasis from prostate cancer,https://pubmed.ncbi.nlm.nih.gov/15590167/,01,12,2004,"International journal of radiation oncology, biology, physics",60,5,0360-3016,Andre,Konski,,,"Department of Radiation Oncology, Fox Chase Cancer Center, Philadelphia, PA 19111, USA. a_konski@fccc.edu",,,,,,,,,,,,,,,,,,,,,,,,,,,,,,,,,,,,,,,,,,,,,,,,,,,,,,,,,,,,,,,,,,,,,,,,,,,,,,,,,,,,,,
radiotherapy after breast-conservation surgery: how much is enough?,https://pubmed.ncbi.nlm.nih.gov/1496224/,XX,XX,1992,Seminars in surgical oncology,8,3,8756-0437,M,Deutsch,,,"Department of Radiation Oncology, University of Pittsburgh Health Center, Pennsylvania.",,,,,,,,,,,,,,,,,,,,,,,,,,,,,,,,,,,,,,,,,,,,,,,,,,,,,,,,,,,,,,,,,,,,,,,,,,,,,,,,,,,,,,
predictive models of toxicity with external radiotherapy for prostate cancer: clinical issues,https://pubmed.ncbi.nlm.nih.gov/19544543/,01,07,2009,Cancer,115,13 Suppl,0008-543X,Riccardo,Valdagni,Tiziana,Rancati,"Prostate Program, Scientific Directorate, National Cancer Institute, Milan, Italy. riccardo.valdagni@istitutotumori.mi.it",Claudio,Fiorino,,,,,,,,,,,,,,,,,,,,,,,,,,,,,,,,,,,,,,,,,,,,,,,,,,,,,,,,,,,,,,,,,,,,,,,,,,,,,,,,,,,,
patterns of care for elderly patients with locally advanced head and neck cancer,https://pubmed.ncbi.nlm.nih.gov/28366573/,29,01,2017,"International journal of radiation oncology, biology, physics",98,4,1879-355X,Jesus E,Juarez,Jehee,Choi,"Department of Radiation Oncology, David Geffen School of Medicine, University of California, Los Angeles, Los Angeles, California.",Maie,St John,Elliot,Abemayor,Mindi,TenNapel,Allen M,Chen,,,,,,,,,,,,,,,,,,,,,,,,,,,,,,,,,,,,,,,,,,,,"Department of Radiation Oncology, University of Kansas School of Medicine, Kansas City, Kansas.","Department of Otolaryngology-Head and Neck Surgery, David Geffen School of Medicine, University of California, Los Angeles, Los Angeles, California.","Department of Otolaryngology-Head and Neck Surgery, David Geffen School of Medicine, University of California, Los Angeles, Los Angeles, California.","Department of Radiation Oncology, University of Kansas School of Medicine, Kansas City, Kansas.","Department of Radiation Oncology, David Geffen School of Medicine, University of California, Los Angeles, Los Angeles, California; Department of Radiation Oncology, University of Kansas School of Medicine, Kansas City, Kansas. Electronic address: achen5@kumc.edu.",,,,,,,,,,,,,,,,,,,,,,,,,,,,,,
positron-emission tomography (pet) and pet/ct in head and neck cancer - recommendations of an interdisciplinary consensus conference,https://pubmed.ncbi.nlm.nih.gov/19219754/,13,02,2009,Laryngo- rhino- otologie,88,2,0935-8943,S,Kohlfürst,M,Markitz,"Abteilung für Nuklearmedizin und Endokrinologie, PET/CT Zentrum, LKH Klagenfurt, Osterreich. susanne.kohlfuerst@lkh-klu.at",W,Raunik,H E,Eckel,E,Kresnik,K,Hausegger,M,Salzwimmer,A,Gaggl,F,Chiari,P,Lind,,,,,,,,,,,,,,,,,,,,,,,,,,,,,,,,,,,,,,,,,,,,,,,,,,,,,,,,,,,,,,,,,,,,,,
"racial/ethnic differences in treatment discussed, preferred, and received for prostate cancer in a tri-ethnic population",https://pubmed.ncbi.nlm.nih.gov/22419652/,13,03,2012,American journal of men's health,6,3,1557-9891,G M Monawar,Hosain,Maureen,Sanderson,"Baylor College of Medicine, Houston, TX 77030, USA.",Xianglin L,Du,Wenyaw,Chan,Sara S,Strom,,,,,,,,,,,,,,,,,,,,,,,,,,,,,,,,,,,,,,,,,,,,,,,,,,,,,,,,,,,,,,,,,,,,,,,,,,,,,,,,
cost-effectiveness of gemcitabine plus modern radiotherapy in locally advanced pancreatic cancer,https://pubmed.ncbi.nlm.nih.gov/27033672/,28,03,2016,Clinical therapeutics,38,5,1879-114X,Henry W C,Leung,Agnes L F,Chan,"Department of Radiation Therapy, An Nan Hospital, China Medical University, Tainan, Taiwan; Department of Information Management, Chia Nan University of Pharmacy and Science, Tainan City, Taiwan.",Chih-Hsin,Muo,,,,,,,,,,,,,,,,,,,,,,,,,,,,,,,,,,,,,,,,,,,,,,,,,,"Department of Pharmacy, An-Nan Hospital, China Medical University, Tainan, Taiwan; Department of Pharmacy, Chia Nan University of Pharmacy and Science, Tainan City, Taiwan. Electronic address: agnes.lf@gmail.com.","Management Office for Health Data, China Medical University Hospital, Taichung, Taiwan.",,,,,,,,,,,,,,,,,,,,,,,,,,,,,,,,,
computer-based risk prediction models: ethical issues of adjuvant! online use in early-stage breast cancer,https://pubmed.ncbi.nlm.nih.gov/26792034/,11,01,2016,"Gynecologie, obstetrique & fertilite",44,2,1769-6682,E,Kempf,E,Azria,"Medical oncology department, Henri-Mondor Hospital, AP-HP, 51, avenue du Maréchal-de-Lattre-de-Tassigny, 94010 Créteil cedex, France. Electronic address: emma@kempf.pro.",A,Kempf,,,,,,,,,,,,,,,,,,,,,,,,,,,,,,,,,,,,,,,,,,,,,,,,,,"INSERM, U-1153, Epidemiology and Biostatistics Sorbonne Paris Cité Center, Obstetrical, Perinatal and Pediatric Epidemiology Team, DHU Risk in Pregnancy, Maternité de Port Royal, 53, avenue de l'Observatoire, 75014 Paris, France; Department of Obstetrics, Paris Descartes University, groupe hospitalier Paris-Saint-Joseph, 185, rue Raymond-Losserand, 75014 Paris, France.","Robert-Debré Hospital management team, AP-HP, 48, boulevard Sérurier, 75019 Paris, France.",,,,,,,,,,,,,,,,,,,,,,,,,,,,,,,,,
"surgery is cost-effective treatment for young patients with vestibular schwannomas: decision tree modeling of surgery, radiation, and observation",https://pubmed.ncbi.nlm.nih.gov/26218621/,XX,11,2014,Neurosurgical focus,37,5,1092-0684,Corinna C,Zygourakis,Taemin,Oh,Departments of Neurological Surgery and.,Matthew Z,Sun,Igor,Barani,James G,Kahn,Andrew T,Parsa,,,,,,,,,,,,,,,,,,,,,,,,,,,,,,,,,,,,,,,,,,,,"Department of Neurological Surgery, Northwestern University, Chicago, Illinois.",Departments of Neurological Surgery and.,"Radiation Oncology, University of California at San Francisco;","Department of Epidemiology and Biostatistics, Philip R Lee Institute for Health Policy Studies, University of California at San Francisco, California; and.","Department of Neurological Surgery, Northwestern University, Chicago, Illinois.",,,,,,,,,,,,,,,,,,,,,,,,,,,,,,
patterns and correlates of adjuvant radiotherapy receipt after lumpectomy and after mastectomy for breast cancer,https://pubmed.ncbi.nlm.nih.gov/20351324/,29,03,2010,Journal of clinical oncology : official journal of the American Society of Clinical Oncology,28,14,1527-7755,Reshma,Jagsi,Paul,Abrahamse,"Department of Radiation Oncology, University of Michigan, UHB2C490, SPC 5010, 1500 E Medical Center Dr, Ann Arbor, MI 48109-5010, USA. rjagsi@med.umich.edu",Monica,Morrow,Sarah T,Hawley,Jennifer J,Griggs,John J,Graff,Ann S,Hamilton,Steven J,Katz,,,,,,,,,,,,,,,,,,,,,,,,,,,,,,,,,,,,,,,,,,,,,,,,,,,,,,,,,,,,,,,,,,,,,,,,,,
a prospective study comparing the predictions of doctors versus models for treatment outcome of lung cancer patients: a step toward individualized care and shared decision making,https://pubmed.ncbi.nlm.nih.gov/24846083/,17,05,2014,Radiotherapy and oncology : journal of the European Society for Therapeutic Radiology and Oncology,112,1,1879-0887,Cary,Oberije,Georgi,Nalbantov,"Department of Radiation Oncology (MAASTRO), GROW - School for Oncology and Developmental Biology, Maastricht University Medical Centre, The Netherlands. Electronic address: cary.oberije@maastro.nl.",Andre,Dekker,Liesbeth,Boersma,Jacques,Borger,Bart,Reymen,Angela,van Baardwijk,Rinus,Wanders,Dirk,De Ruysscher,Ewout,Steyerberg,Anne-Marie,Dingemans,Philippe,Lambin,,,,,,,,,,,,,,,,,,,,,,,,,,,,,,,,"Department of Radiation Oncology (MAASTRO), GROW - School for Oncology and Developmental Biology, Maastricht University Medical Centre, The Netherlands.","Department of Radiation Oncology (MAASTRO), GROW - School for Oncology and Developmental Biology, Maastricht University Medical Centre, The Netherlands.","Department of Radiation Oncology (MAASTRO), GROW - School for Oncology and Developmental Biology, Maastricht University Medical Centre, The Netherlands.","Department of Radiation Oncology (MAASTRO), GROW - School for Oncology and Developmental Biology, Maastricht University Medical Centre, The Netherlands.","Department of Radiation Oncology (MAASTRO), GROW - School for Oncology and Developmental Biology, Maastricht University Medical Centre, The Netherlands.","Department of Radiation Oncology (MAASTRO), GROW - School for Oncology and Developmental Biology, Maastricht University Medical Centre, The Netherlands.","Department of Radiation Oncology (MAASTRO), GROW - School for Oncology and Developmental Biology, Maastricht University Medical Centre, The Netherlands.","Department of Radiation Oncology, University Hospital Leuven/KU Leuven, Belgium.","Department of Public Health, Erasmus Medical Center, Rotterdam, The Netherlands.","Department of Pulmonology, GROW - School for Oncology and Developmental Biology, Maastricht University Medical Centre, The Netherlands.","Department of Radiation Oncology (MAASTRO), GROW - School for Oncology and Developmental Biology, Maastricht University Medical Centre, The Netherlands.",,,,,,,,,,,,,,,,,,,,,,,,
establishing cost-effective allocation of proton therapy for breast irradiation,https://pubmed.ncbi.nlm.nih.gov/27084617/,19,03,2016,"International journal of radiation oncology, biology, physics",95,1,1879-355X,Raymond B,Mailhot Vega,Omar,Ishaq,"Department of Radiation Oncology, NYU School of Medicine, New York, New York.",Ann,Raldow,Carmen A,Perez,Rachel,Jimenez,Marielle,Scherrer-Crosbie,Marc,Bussiere,Alphonse,Taghian,David J,Sher,Shannon M,MacDonald,,,,,,,,,,,,,,,,,,,,,,,,,,,,,,,,,,,,"Department of Radiation Oncology, NYU School of Medicine, New York, New York.","Radiation Oncology Program, Harvard University, Boston, Massachusetts.","Department of Radiation Oncology, NYU School of Medicine, New York, New York.","Department of Radiation Oncology, Harvard Medical School, Massachusetts General Hospital, Boston, Massachusetts.","Cardiovascular Research Center, Harvard Medical School, Massachusetts General Hospital, Boston, Massachusetts.","Department of Radiation Oncology, Harvard Medical School, Massachusetts General Hospital, Boston, Massachusetts.","Department of Radiation Oncology, Harvard Medical School, Massachusetts General Hospital, Boston, Massachusetts.","Department of Radiation Oncology, University of Texas Southwestern Medical Center, San Antonio, Texas.","Department of Radiation Oncology, Harvard Medical School, Massachusetts General Hospital, Boston, Massachusetts. Electronic address: smacdonald@partners.org.",,,,,,,,,,,,,,,,,,,,,,,,,,
spacers in radiotherapy treatment of prostate cancer: is reduction of toxicity cost-effective?,https://pubmed.ncbi.nlm.nih.gov/25616537/,20,01,2015,Radiotherapy and oncology : journal of the European Society for Therapeutic Radiology and Oncology,114,2,1879-0887,Ben G L,Vanneste,Madelon,Pijls-Johannesma,"Department of Radiation Oncology (MAASTRO), GROW - School for Oncology and Developmental Biology, Maastricht University Medical Center+, The Netherlands. Electronic address: ben.vanneste@maastro.nl.",Lien,Van De Voorde,Emile N,van Lin,Kees,van de Beek,Judith,van Loon,Bram L,Ramaekers,Philippe,Lambin,,,,,,,,,,,,,,,,,,,,,,,,,,,,,,,,,,,,,,,,"Department of Radiation Oncology (MAASTRO), GROW - School for Oncology and Developmental Biology, Maastricht University Medical Center+, The Netherlands; Health insurance company CZ, Tilburg, The Netherlands.","Department of Radiation Oncology (MAASTRO), GROW - School for Oncology and Developmental Biology, Maastricht University Medical Center+, The Netherlands.","Westdeutsches Protonentherapiezentrum Essen (WPE), Germany.","Department of Urology, Maastricht University Medical Center+, The Netherlands.","Department of Radiation Oncology (MAASTRO), GROW - School for Oncology and Developmental Biology, Maastricht University Medical Center+, The Netherlands.","Department of Radiation Oncology (MAASTRO), GROW - School for Oncology and Developmental Biology, Maastricht University Medical Center+, The Netherlands; Department of Clinical Epidemiology and Medical Technology Assessment, Maastricht University Medical Center+, The Netherlands.","Department of Radiation Oncology (MAASTRO), GROW - School for Oncology and Developmental Biology, Maastricht University Medical Center+, The Netherlands.",,,,,,,,,,,,,,,,,,,,,,,,,,,,
a report of the consensus workshop panel on the treatment of brain metastases,https://pubmed.ncbi.nlm.nih.gov/1572820/,XX,XX,1992,"International journal of radiation oncology, biology, physics",23,1,0360-3016,L R,Coia,N,Aaronson,"Department of Radiation Oncology, Fox Chase Cancer Center/University of Pennsylvania, Philadelphia 19111.",R,Linggood,J,Loeffler,T J,Priestman,,,,,,,,,,,,,,,,,,,,,,,,,,,,,,,,,,,,,,,,,,,,,,,,,,,,,,,,,,,,,,,,,,,,,,,,,,,,,,,,
overdiagnosis of prostate carcinoma by screening: an estimate based on the results of the florence screening pilot study,https://pubmed.ncbi.nlm.nih.gov/9932159/,XX,12,1998,Annals of oncology : official journal of the European Society for Medical Oncology,9,12,0923-7534,M,Zappa,S,Ciatto,"Centro per lo Studio e la Prevenzione Oncologica, Florence, Italy.",R,Bonardi,A,Mazzotta,,,,,,,,,,,,,,,,,,,,,,,,,,,,,,,,,,,,,,,,,,,,,,,,,,,,,,,,,,,,,,,,,,,,,,,,,,,,,,,,,,
when and how to treat an imrt patient on a second accelerator without replanning?,https://pubmed.ncbi.nlm.nih.gov/29287919/,26,12,2017,Medical dosimetry : official journal of the American Association of Medical Dosimetrists,43,4,1873-4022,Teh,Lin,Murshed,Hossain,"Department of Radiation Oncology, Fox Chase Cancer Center, 333 Cottman Avenue, Philadelphia, PA 19111, USA. Electronic address: Teh.Lin@fccc.edu.",Jiajin,Fan,C-M Charlie,Ma,,,,,,,,,,,,,,,,,,,,,,,,,,,,,,,,,,,,,,,,,,,,,,,,"Department of Radiation Oncology, Fox Chase Cancer Center, 333 Cottman Avenue, Philadelphia, PA 19111, USA.","Department of Radiation Oncology, Fox Chase Cancer Center, 333 Cottman Avenue, Philadelphia, PA 19111, USA.","Department of Radiation Oncology, Fox Chase Cancer Center, 333 Cottman Avenue, Philadelphia, PA 19111, USA.",,,,,,,,,,,,,,,,,,,,,,,,,,,,,,,,
cost effectiveness of proton therapy compared with photon therapy in the management of pediatric medulloblastoma,https://pubmed.ncbi.nlm.nih.gov/24105630/,16,09,2013,Cancer,119,24,1097-0142,Raymond B,Mailhot Vega,Jane,Kim,"Department of Radiation Oncology, Washington University in St. Louis School of Medicine, St. Louis, Missouri.",Marc,Bussière,Jona,Hattangadi,Abby,Hollander,Jeff,Michalski,Nancy J,Tarbell,Torunn,Yock,Shannon M,MacDonald,,,,,,,,,,,,,,,,,,,,,,,,,,,,,,,,,,,,,,,,,,,,,,,,,,,,,,,,,,,,,,,,,,,,,,,,
"re: byron h. lee, adam s. kibel, jay p. ciezki, et al. are biochemical recurrence outcomes similar after radical prostatectomy and radiation therapy? analysis of prostate cancer-specific mortality by nomogram-predicted risks of biochemical recurrence. eur urol 2015;67:204-9",https://pubmed.ncbi.nlm.nih.gov/25913064/,22,04,2015,European urology,68,3,1873-7560,Kevin,Lu,,,"Division of Urology, Department of Surgery, E-Da Hospital, Kaohsiung City, Taiwan, Republic of China; School of Medicine, I-Shou University, Kaohsiung City, Taiwan, Republic of China. Electronic address: kevinlu0620@mail2000.com.tw.",,,,,,,,,,,,,,,,,,,,,,,,,,,,,,,,,,,,,,,,,,,,,,,,,,,,,,,,,,,,,,,,,,,,,,,,,,,,,,,,,,,,,,
"cost-effectiveness analysis of stereotactic body radiotherapy and radiofrequency ablation for medically inoperable, early-stage non-small cell lung cancer",https://pubmed.ncbi.nlm.nih.gov/21300476/,06,02,2011,"International journal of radiation oncology, biology, physics",81,5,1879-355X,David J,Sher,Jon O,Wee,"Department of Radiation Oncology, Dana-Farber Cancer Institute/Brigham and Women's Hospital, Boston, MA 02115, USA. dsher@lroc.harvard.edu",Rinaa S,Punglia,,,,,,,,,,,,,,,,,,,,,,,,,,,,,,,,,,,,,,,,,,,,,,,,,,,,,,,,,,,,,,,,,,,,,,,,,,,,,,,,,,,,
strategic level proton therapy patient admission planning: a markov decision process modeling approach,https://pubmed.ncbi.nlm.nih.gov/26810359/,25,01,2016,Health care management science,20,2,1386-9620,Ridvan,Gedik,Shengfan,Zhang,"Mechanical and Industrial Engineering Department Tagliatela College of Engineering, University of New Haven, West Haven, CT, USA.",Chase,Rainwater,,,,,,,,,,,,,,,,,,,,,,,,,,,,,,,,,,,,,,,,,,,,,,,,,,"Department of Industrial Engineering, University of Arkansas, Fayetteville, AR, USA. shengfan@uark.edu.","Department of Industrial Engineering, University of Arkansas, Fayetteville, AR, USA.",,,,,,,,,,,,,,,,,,,,,,,,,,,,,,,,,
determination of the human tissue interaction parameters for monte carlo dose calculations in radiotherapy,https://pubmed.ncbi.nlm.nih.gov/11370556/,XX,04,2001,Strahlentherapie und Onkologie : Organ der Deutschen Rontgengesellschaft ... [et al],177,4,0179-7158,M,Fippel,F,Nüsslin,"Abteilung für Medizinische Physik, Universitätsklinikum Tübingen. msfippel@med.uni-tuebingen.de",,,,,,,,,,,,,,,,,,,,,,,,,,,,,,,,,,,,,,,,,,,,,,,,,,,,,,,,,,,,,,,,,,,,,,,,,,,,,,,,,,,,,,
preoperative chemoradiotherapy for adenocarcinoma of the pancreas. rationale and technique,https://pubmed.ncbi.nlm.nih.gov/1862769/,XX,08,1991,American journal of clinical oncology,14,4,0277-3732,D B,Evans,D R,Byrd,"Department of General Surgery, University of Texas M.D. Anderson Cancer Center, Houston 77030.",P F,Mansfield,,,,,,,,,,,,,,,,,,,,,,,,,,,,,,,,,,,,,,,,,,,,,,,,,,,,,,,,,,,,,,,,,,,,,,,,,,,,,,,,,,,,
imaging and scopes? it's bloody time for another branch in the decision tree,https://pubmed.ncbi.nlm.nih.gov/29482847/,08,02,2018,The Journal of thoracic and cardiovascular surgery,155,5,1097-685X,Virginia R,Litle,,,"Division of Thoracic Surgery, Department of Surgery, Boston University School of Medicine, Boston, Mass. Electronic address: Virginia.litle@bmc.org.",,,,,,,,,,,,,,,,,,,,,,,,,,,,,,,,,,,,,,,,,,,,,,,,,,,,,,,,,,,,,,,,,,,,,,,,,,,,,,,,,,,,,,
report dose-to-medium in clinical trials where available; a consensus from the global harmonisation group to maximize consistency,https://pubmed.ncbi.nlm.nih.gov/33741471/,17,03,2021,Radiotherapy and oncology : journal of the European Society for Therapeutic Radiology and Oncology,159,,1879-0887,Stephen F,Kry,Jessica,Lye,"Imaging and Radiation Oncology Core, The University of Texas MD Anderson Cancer Center, Houston, USA. Electronic address: sfkry@mdanderson.org.",Catharine H,Clark,Nicolaus,Andratschke,Alexis,Dimitriadis,David,Followill,Rebecca,Howell,Mohammad,Hussein,Masayori,Ishikawa,Satoshi,Kito,Tomas,Kron,Jonny,Lee,Jeff,Michalski,Angelo,Filippo Monti,Nick,Reynaert,Paige,Taylor,Karen,Venables,Ying,Xiao,Joerg,Lehmann,,,,,,,,,,,,,,,,,,"Australian Clinical Dosimetry Service, Australian Radiation Protection and Nuclear Safety Agency, Melbourne, Australia; Olivia Newton-John Cancer Research and Wellness Centre, Melbourne, Australia.","NIHR Radiotherapy Trials Quality Assurance Group, University College London Hospital, University College London, National Physical Laboratory, UK.","European Organisation for Research and Treatment of Cancer Radiotherapy Quality Assurance Group, University Hospital of Zurich, University of Zurich, Switzerland.","Dosimetry and Medical Radiation Physics Section, Division of Human Health, Department of Nuclear Sciences and Applications, International Atomic Energy Agency, Vienna, Austria.","Imaging and Radiation Oncology Core, The University of Texas MD Anderson Cancer Center, Houston, USA.","Radiation Dosimetry Services, The University of Texas MD Anderson Cancer Center, Houston, USA.","National Physical Laboratory, UK.","Japan Clinical Oncology Group, Faculty of Health Sciences, Hokkaido University, Japan.","Japan Clinical Oncology Group, Department of Radiation Oncology, Tokyo Metropolitan Cancer and Infectious Disease Center Komagome Hospital, Japan.","Trans Tasman Radiation Oncology Group (TROG), Newcastle, Australia; Peter MacCallum Cancer Centre, Melbourne, Australia.","NIHR Radiotherapy Trials Quality Assurance Group, Mount Vernon Cancer Centre, Northwood, UK.","Imaging and Radiation Oncology Core, Washington University School of Medicine, St. Louis, USA.","European Organisation for Research and Treatment of Cancer (EORTC), Department of Medical Physics, ASST GOM Niguarda Hospital, Milan, Italy.","European Organisation for Research and Treatment of Cancer, Medical Physics Department, Jules Bordet Institute, Université Libre de Bruxelles, Brussels, Belgium.","Imaging and Radiation Oncology Core, The University of Texas MD Anderson Cancer Center, Houston, USA.","NIHR Radiotherapy Trials Quality Assurance Group, Mount Vernon Cancer Centre, Northwood, UK.","Imaging and Radiation Oncology Core, University of Pennsylvania, Philadelphia, USA.","Trans Tasman Radiation Oncology Group (TROG), Newcastle, Australia; Radiation Oncology Department, Calvary Mater Newcastle, Australia; School of Mathematical and Physical Sciences, University of Newcastle, Australia; Institute of Medical Physics, University of Sydney, Australia.",,,,,,,,,,,,,,,,,
challenges for nuclear medicine in the 1990s,https://pubmed.ncbi.nlm.nih.gov/1436900/,XX,02,1992,Nuclear medicine communications,13,2,0143-3636,P J,Ell,,,"Institute of Nuclear Medicine, University College and Middlesex School of Medicine, London, UK.",,,,,,,,,,,,,,,,,,,,,,,,,,,,,,,,,,,,,,,,,,,,,,,,,,,,,,,,,,,,,,,,,,,,,,,,,,,,,,,,,,,,,,
